No,Title,Short description,Image Link,Image caption
SF39,मिशेल स्टार्क,"मिशेल आरोन स्टार्क, एक ऑस्ट्रेलियाई अंतरराष्ट्रीय क्रिकेटर हैं, जो ऑस्ट्रेलियाई राष्ट्रीय टीम और घरेलू क्रिकेट में न्यू साउथ वेल्स के लिए खेलते हैं। वह बाएं हाथ के तेज गेंदबाज और निचले क्रम के बाएं हाथ के एक सक्षम बल्लेबाज हैं।",https://en.wikipedia.org/wiki/Mitchell_Starc#/media/File:Mitchell_Starc.jpg,मिशेल स्टार्क
SF40,फ्लोयड रिफ़र,"फ्लॉयड लामोन्टे रिफ़र बारबाडियन क्रिकेटर हैं। वह बाएं हाथ के मध्य क्रम के बल्लेबाज और दाएं हाथ के मध्यम गति के गेंदबाज हैं। रिफ़र ने वेस्ट इंडीज़ क्रिकेट टीम के लिए छह टेस्ट और आठ एक दिवसीय अंतरराष्ट्रीय मैच खेले हैं, जो 1997 में श्रीलंका के खिलाफ एक घरेलू दौरे और आईसीसी चैंपियंस ट्रॉफी के 2009 संस्करण में खेले गए थे।",no image available,लागू नहीं
SF41,मार्टिन क्रो,"मार्टिन डेविड क्रो एमबीई न्यूजीलैंड के पूर्व क्रिकेटर, टेस्ट और एकदिवसीय कप्तान के साथ-साथ एक कमेंटेटर भी थे। उन्होंने 1982 और 1995 के बीच न्यूजीलैंड की राष्ट्रीय क्रिकेट टीम के लिए खेला और उन्हें देश का सबसे महान बल्लेबाज माना जाता है।",https://en.wikipedia.org/wiki/Martin_Crowe#/media/File:Martin_Crowe_2011.jpg,मार्टिन क्रो ने 2011 में एक चैरिटी मैच में बल्लेबाजी की
SF42,लांस क्लूजनर,"लांस क्लूजनर दक्षिण अफ्रीका के पूर्व हरफनमौला क्रिकेटर हैं। वह अपनी आक्रामक बल्लेबाजी और तेज-मध्यम स्विंग गेंदबाजी के लिए जाने जाते हैं। ज़ुलु भाषा में वाकपटुता के कारण उन्हें ""ज़ुलु"" उपनाम दिया गया है। अपनी सेवानिवृत्ति के बाद से उन्होंने कभी-कभी ज़ुलु और झोसा दोनों में क्रिकेट पर टिप्पणी की है।",no image available,लागू नहीं
SF43,ज्योफ अलॉट,"ज्योफ्री इयान अलॉट न्यूजीलैंड के पूर्व क्रिकेटर हैं, जिन्होंने 1996 से 2000 तक 10 टेस्ट और 31 एक दिवसीय अंतरराष्ट्रीय मैचों में खेला था। चोटों की एक श्रृंखला के बाद, उन्होंने 2001 में सभी प्रकार के क्रिकेट से संन्यास ले लिया।",no image available,लागू नहीं
SF44,मिकी आर्थर,"जॉन माइकल ""मिकी"" आर्थर एक दक्षिण अफ्रीकी क्रिकेट कोच और पूर्व क्रिकेटर हैं, जो 1986 से 2001 तक दक्षिण अफ्रीकी घरेलू क्रिकेट में खेलते थे। वह पाकिस्तान क्रिकेट टीम के वर्तमान कोच हैं।",https://en.wikipedia.org/wiki/Mickey_Arthur#/media/File:Mickey_Arthur.jpg,मिकी आर्थर
SF45,ओटिस गिब्सन,ओटिस डेलारॉय गिब्सन बारबाडोस के पूर्व भारतीय खिलाड़ी हैं। एक तेज गेंदबाज और वेस्ट इंडीज के लिए पुरानी क्रिकेट गेंद का फायदा उठाने वाले गिब्सन अब दक्षिण अफ्रीकी क्रिकेट टीम के मुख्य कोच हैं।,no image available,लागू नहीं
SF46,गैरी स्टीड,"गैरी रेमंड स्टीड न्यूजीलैंड के पूर्व टेस्ट क्रिकेटर हैं, जो न्यूजीलैंड क्रिके टीम के मुख्य कोच हैं, जिन्हें अगस्त 2018 में नियुक्त किया गया है। एक शीर्ष क्रम के बल्लेबाज, स्टीड ने 1999 में नौ महीनों में पांच टेस्ट खेले, जिनका औसत 34.75 रहा और कभी भी इकाई अंकों में आउट नहीं हुए।",https://commons.wikimedia.org/wiki/File:Gary_Stead.jpg,गैरी स्टीड
SF48,शेन वार्न,"शेन कीथ वार्न एक ऑस्ट्रेलियाई क्रिकेट कमेंटेटर और पूर्व क्रिकेटर और ऑस्ट्रेलियाई राष्ट्रीय टीम के एकदिवसीय कप्तान हैं। उन्हें खेल के इतिहास में व्यापक रूप से सबसे महान गेंदबाजों में से एक के रूप में माना जाता है, वार्न को 1994 के विजडन क्रिकेटर्स अलमैनैक में विजडन क्रिकेटर्स ऑफ द ईयर के रूप में नामित किया गया था।",https://en.wikipedia.org/wiki/Shane_Warne#/media/File:Shane_Warne_February_2015.jpg,शेन वार्न
SF49,रिकी पोंटिंग,"रिकी थॉमस पोंटिंग, एओ, एक ऑस्ट्रेलियाई क्रिकेट कमेंटेटर और पूर्व क्रिकेटर हैं, और 2003 और 2007 में दो बार के विश्व कप विजेता कप्तान, व्यापक रूप से सभी समय के महानतम बल्लेबाजों में से एक माने जाते हैं। पोंटिंग अपने 'स्वर्ण युग' 2004 और 2011 के बीच टेस्ट और 2002 और 2011 के बीच वन डे के दौरान ऑस्ट्रेलियाई राष्ट्रीय टीम के कप्तान थे।",https://en.wikipedia.org/wiki/Ricky_Ponting#/media/File:Ricky_Ponting_2015.jpg,रिकी पोंटिंग
SF50,ट्रेवर बेलिस,"ट्रेवर हार्ले बेलिस एक ऑस्ट्रेलियाई क्रिकेट कोच और पूर्व प्रथम श्रेणी क्रिकेटर हैं। उन्होंने कोच बनने से पहले 1985 से 1997 के बीच न्यू साउथ वेल्स के लिए खेला। बेलिस वर्तमान में इंग्लैंड के कोच हैं। उन्होंने 2007 और 2011 के बीच श्रीलंका की कोचिंग की, एक ऐसी अवधि जिसमें उनकी टीम का समापन 2011 विश्व कप में उपविजेता के रूप में हुआ।",no image available,लागू नहीं
SF51,इमरान खान,"इमरान अहमद खान नियाज़ी एचआई पीपी एक पाकिस्तानी राजनेता और पूर्व अंतरराष्ट्रीय क्रिकेटर हैं, जो पाकिस्तान के 22 वें और पदस्थ प्रधानमंत्री हैं।",https://en.wikipedia.org/wiki/Imran_Khan#/media/File:Mike_Pompeo_with_Imran_Khan_in_Islamabad_-_2018_(29559549217)_(cropped).jpg,इमरान खान
SF52,चमिंडा वास,"वारनकुलासुरिया पटाबेंदिगे उशांथा जोसेफ चमिंडा वास, जो कि अधिक व्यापक रूप से चमिंडा वास के रूप में जाने जाते हैं, एक पूर्व श्रीलंकाई अंतरराष्ट्रीय क्रिकेटर हैं, जिन्होंने खेल के सभी रूपों, और एक पूर्व एकदिवसीय कप्तान की भूमिका निभाई। अक्सर 'श्रीलंका के सार्वकालिक सबसे भेदक और सफल नए गेंदबाज' के रूप में वर्णित' वास वर्तमान में एकदिवसीय इतिहास में सर्वश्रेष्ठ गेंदबाजी का रिकॉर्ड रखते हैं, और एकदिवसीय में 8 विकेट लेने का रिकॉर्ड रखने वाले एकमात्र गेंदबाज़ हैं।",https://en.wikipedia.org/wiki/Chaminda_Vaas#/media/File:Chaminda_Vaas.jpg,चमिंडा वास
SF53,सुनील नरेन,"सुनील फिलिप नरेन भारतीय मूल के एक त्रिनिदादी क्रिकेटर हैं जो वेस्ट इंडीज के लिए खेलते हैं। मुख्य रूप से एक ऑफ स्पिन गेंदबाज, एक आक्रामक बाएं हाथ के बल्लेबाज भी हैं।",no image available,लागू नहीं
SF54,जावेद मियांदाद,"मोहम्मद जावेद मियांदाद, जिन्हें जावेद मियांदाद के नाम से जाना जाता है, एक पाकिस्तानी क्रिकेट कोच, कमेंटेटर और पूर्व क्रिकेटर हैं जो कप्तानी और बल्लेबाजी की अपनी अपरंपरागत शैली के लिए जाने जाते हैं।",https://commons.wikimedia.org/wiki/File:Rene_Schoonheim_and_Javed_Miandad_1978.jpg,रेने शूनहेम और जावेद मियांदाद
SF55,इंजमाम-उल-हक,"सैयद इंजमाम-उल-हक, जिन्हें इन्ज़ी के नाम से भी जाना जाता है, एक पूर्व पाकिस्तानी क्रिकेटर और पूर्व कप्तान हैं।",https://en.wikipedia.org/wiki/Inzamam-ul-Haq#/media/File:Inzamam-ul-Haq.jpg,इंजमाम उल हक
SF56,एलन डोनाल्ड,"एलन एंथनी डोनाल्ड दक्षिण अफ्रीका के पूर्व क्रिकेटर हैं जो अब क्रिकेट कोच हैं। अक्सर 'व्हाइट लाइटनिंग' के उपनाम से ज्ञात, उन्हें दक्षिण अफ्रीका की राष्ट्रीय क्रिकेट टीम के सबसे सफल तेज गेंदबाजों में से एक माना जाता है।",https://en.wikipedia.org/wiki/Allan_Donald#/media/File:Allan_Donald.jpg,एलन डोनाल्ड
SF57,जैक्स कैलिस,"जैक्स कैलिस दक्षिण अफ्रीका के पूर्व क्रिकेटर और पूर्व टेस्ट और वनडे कप्तान हैं। दाएं हाथ के बल्लेबाज और दाएं हाथ के तेज-तर्रार स्विंग गेंदबाज के रूप में, कैलिस को अब तक के सबसे महान क्रिकेटरों में से एक और खेल का सबसे बड़ा आल राउंडर माना जाता है।",https://en.wikipedia.org/wiki/Jacques_Kallis#/media/File:JAQUES_KALLIS_(3175901786).jpg,जैक्स कैलिस
SF58,ब्रेंडन मैकुलम,"ब्रेंडन बैरी ""बाज"" मैकुलम, ओएनजेडएम न्यूजीलैंड के पूर्व अंतरराष्ट्रीय क्रिकेटर हैं, जिन्होंने सभी प्रारूपों में खेला है, और सभी प्रारूपों में पूर्व कप्तान भी हैं। मैकुलम ने टेस्ट मैचों में भी तेज स्कोरिंग की, विशेष रूप से अब तक के सबसे तेज टेस्ट शतक का रिकॉर्ड बनाया। उन्हें न्यूजीलैंड क्रिकेट के सबसे सफल बल्लेबाजों और कप्तानों में से एक माना जाता है।",https://en.wikipedia.org/wiki/Brendon_McCullum#/media/File:England_vs._New_Zealand_2015_(3)_(McCullum_further_cropped).jpg,ब्रेंडन मैकुलम
SF59,सनथ जयसूर्या,"देशबंधु सनथ तेरन जयसूर्या श्रीलंका के पूर्व क्रिकेटर और श्रीलंकाई राष्ट्रीय टीम के पूर्व कप्तान हैं। उन्हें सार्वकालिक महानतम एक दिवसीय अंतरराष्ट्रीय (ओडीआई) खिलाड़ियों में से एक माना जाता है, जयसूर्या अपने शक्तिशाली स्ट्राइक और वनडे क्रिकेट में हरफनमौला प्रदर्शन के लिए जाने जाते हैं।",https://en.wikipedia.org/wiki/Sanath_Jayasuriya#/media/File:Sanath_jayasuriya_portrait.jpg,सनथ जयसूर्या
SF60,मुथैया मुरलीधरन,"देशबंधु मुथैया मुरलीधरन एक पूर्व श्रीलंकाई क्रिकेटर हैं, जिन्हें 2002 में विजडन क्रिकेटर्स अलमैनैक द्वारा अब तक का सबसे बड़ा टेस्ट मैच गेंदबाज घोषित किया गया था।",https://en.wikipedia.org/wiki/Muttiah_Muralitharan#/media/File:Photograph_of_Muttiah_Muralitharan.jpg,मुथैया मुरलीधरन
SF61,अर्जुन रणतुंगा,"देशमान्य अर्जुन रणतुंगा श्रीलंका के पूर्व क्रिकेटर और 1996 के क्रिकेट विश्व कप विजेता श्रीलंका के कप्तान हैं। अक्सर कैप्टन कूल के नाम से जाने जाने वाले, उन्हें श्रीलंकाई क्रिकेट को अंडरडॉग की स्थिति से उठाने के लिए अग्रणी माना जाता है। रणतुंगा ने अपने राजनीतिक करियर की शुरुआत 2005 में की थी, और वर्तमान में परिवहन और नागरिक उड्डयन के कैबिनेट मंत्री हैं।",https://en.wikipedia.org/wiki/Arjuna_Ranatunga#/media/File:Arjuna_Ranatunga.jpg,अर्जुन रणतुंगा
SF62,कुमार संगकारा,कुमार संगकारा एक श्रीलंकाई क्रिकेट कमेंटेटर और पूर्व क्रिकेटर और श्रीलंकाई राष्ट्रीय टीम के कप्तान हैं। उन्हें व्यापक रूप से दुनिया के सबसे प्रभावशाली क्रिकेटरों में से एक और सर्वकालिक महान बल्लेबाजों में से एक माना जाता है।,https://en.wikipedia.org/wiki/Kumar_Sangakkara#/media/File:Sangakkara_(portrait).jpg,कुमार संगकारा
SF63,क्लाइव लॉयड,क्लाइव हुबर्ट लॉयड सीबीई एओ वेस्टइंडीज के पूर्व क्रिकेटर हैं। 1971 में उन्हें विजडन क्रिकेटर ऑफ द ईयर नामित किया गया था। उन्होंने 1974 और 1985 के बीच वेस्टइंडीज की कप्तानी की और दबदबे वाला टेस्ट खेलने वाला देश बनने के लिए उसका नेतृत्व किया।,https://en.wikipedia.org/wiki/Clive_Lloyd#/media/File:Clive_Lloyd_at_%27Idea_Champions_Of_The_World%27_press_meet.jpg,क्लाइव लॉयड
SF64,कर्टली एम्ब्रोस,"सर कर्टली एलकन लिनवाल एम्ब्रोस, केसीएन एंटीगुआ के पूर्व क्रिकेटर हैं जिन्होंने वेस्टइंडीज के लिए 98 टेस्ट मैच खेले। एक तेज़ गेंदबाज़, उन्होंने 20.99 की औसत से 405 टेस्ट विकेट लिए और अपने करियर के लिए आईसीसी प्लेयर रैंकिंग में सबसे ऊपर रहे और उन्हें दुनिया का सर्वश्रेष्ठ गेंदबाज माना गया। ",https://en.wikipedia.org/wiki/Curtly_Ambrose#/media/File:Curtly_ambrose2_crop.jpg,कर्टली एम्ब्रोस
SF65,विव रिचर्ड्स,"सर आइजैक विवियन अलेक्जेंडर रिचर्ड्स, केएनएच, ओबीई, जिन्हें विव रिचर्ड्स के नाम से जाना जाता है, एक एंटीगुअन पूर्व क्रिकेटर हैं, जिन्होंने टेस्ट और अंतरराष्ट्रीय स्तर पर वेस्टइंडीज का प्रतिनिधित्व किया। उन्हें सर्वकालिक महान बल्लेबाजों में से एक माना जाता है।",https://en.wikipedia.org/wiki/Viv_Richards#/media/File:Vivian_richards_crop.jpg,विव रिचर्ड्स
SF66,वकार यूनिस,"वकार यूनिस एक पाकिस्तानी ऑस्ट्रेलियाई क्रिकेट कोच, कमेंटेटर और पूर्व क्रिकेटर हैं जिन्होंने पाकिस्तान की राष्ट्रीय क्रिकेट टीम की कप्तानी की। दाएं हाथ के तेज गेंदबाज, वकार को अब तक के सबसे महान गेंदबाजों में से एक माना जाता है। वह पाकिस्तानी क्रिकेट टीम के पूर्व कोच भी हैं।",https://en.wikipedia.org/wiki/Waqar_Younis#/media/File:Waqar_younis.jpg,वकार युनिस
SF67,ब्रायन लारा,"ब्रायन चार्ल्स लारा, टीसी, ओसीसी, एएम एक त्रिनिदादी पूर्व अंतरराष्ट्रीय क्रिकेटर हैं, जिन्हें व्यापक रूप से सभी समय के महानतम बल्लेबाजों में से एक माना जाता है। उन्होंने कई मौकों पर टेस्ट बल्लेबाजी रैंकिंग में शीर्ष स्थान हासिल किया और कई क्रिकेट रिकॉर्ड बनाए।",https://en.wikipedia.org/wiki/Brian_Lara#/media/File:Brian_Lara_at_2012_Mumbai_Marathon_pre_bash.jpg,ब्रायन लारा
SF68,ग्राहम गूच,"ग्राहम एलन गूच, ओबीई, डीएल एक पूर्व अंग्रेजी प्रथम श्रेणी के क्रिकेटर हैं जिन्होंने एसेक्स और इंग्लैंड की कप्तानी की। वह अपनी पीढ़ी के सबसे सफल अंतरराष्ट्रीय बल्लेबाजों में से एक थे, और 1973 से 2000 तक फैले करियर के माध्यम से, वह प्रथम श्रेणी और सीमित ओवरों के खेल में 67,057 रन के साथ, अब तक के सबसे विपुल रन स्कोरर बन गए।",https://en.wikipedia.org/wiki/Graham_Gooch#/media/File:Graham_Gooch_01.jpg,ग्राहम गूच
SF69,आंद्रे रसेल,"आंद्रे ड्वेन रसेल एक जमैका निवासी क्रिकेटर हैं। रसेल अंतरराष्ट्रीय स्तर पर वेस्टइंडीज के लिए और जमैका में वेस्टइंडीज के घरेलू क्रिकेट में एक ऑलराउंडर के रूप में खेलते हैं। वह मुख्य रूप से वेस्टइंडीज के लिए मध्य क्रम में बल्लेबाजी करते हैं। व्यापक रूप से क्रिकेट गेंद के सबसे शक्तिशाली स्ट्राइकरों में से एक के रूप में माना जाता है, रसेल ने 2018 कैरिबियन प्रीमियर लीग में ट्रिनबागो नाइट राइडर्स के खिलाफ रिकॉर्ड 40 गेंदों में शतक बनाया।",https://en.wikipedia.org/wiki/Andre_Russell#/media/File:Andre_Russell_2018_.jpg,आंद्रे रसेल
