Fact Id,Relevant Image,Heading,Fact,Read More Text,Linking article,Article ID
F1,https://en.wikipedia.org/wiki/1975_Cricket_World_Cup#/media/File:Prudential_Cup_75_logo.svg,Just 18,"Before the 1975 World Cup, only 18 ODI matches had been played between nations participating in test matches","Read more about the 1975 World Cup
",1975 World cup,
F2,https://en.wikipedia.org/wiki/1975_Cricket_World_Cup#/media/File:Prudential_Cup_75_logo.svg,Indian start,"Indian bowler, Madan Lal, bowled the first ball of the first World Cup to John Jameson of England.","Read more about the 1975 World Cup
",1975 World cup,
F3,https://en.wikipedia.org/wiki/India_national_cricket_team#/media/File:Flagcricket.jpg,Indian start,"Indian bowler, Madan Lal, bowled the first ball of the first World Cup to John Jameson of England.",Read more about the Indian Cricket team,Indian Cricket team,
F4,https://en.wikipedia.org/wiki/1975_Cricket_World_Cup#/media/File:Prudential_Cup_75_logo.svg,Infamous 36,"In the opening match for the 1975 World Cup, Sunil Gavaskar scored his infamous 36 runs off of 174 balls against England.","Read more about the 1975 World Cup
",1975 World cup,
F5,https://en.wikipedia.org/wiki/1975_Cricket_World_Cup#/media/File:Prudential_Cup_75_logo.svg,Infamous 36,"In the opening match for the 1975 World Cup, Sunil Gavaskar scored his infamous 36 runs off of 174 balls against England.",Read more about the Indian Cricket team,Indian Cricket team,
F6,https://en.wikipedia.org/wiki/1979_Cricket_World_Cup#/media/File:Prudential_Cup_79_logo.svg,No African nation,"As East Africa did not qualify for the 1979 World Cup, this was the first World Cup with no participation from the African region","Read more about the 1979 World Cup
",1979 World cup,
F7,https://en.wikipedia.org/wiki/1979_Cricket_World_Cup#/media/File:Prudential_Cup_79_logo.svg,Lowest score,"Canada recorded the lowest score in a World Cup match with 45 runs against England. They went and broke it during the 2003 World Cup, against Sri Lanka, when they managed to score only 36 runs.-","Read more about the 1979 World Cup
",1979 World cup,
F8,https://en.wikipedia.org/wiki/1979_Cricket_World_Cup#/media/File:Prudential_Cup_79_logo.svg,No wins for India,"India failed to win a single match in the competition, the only test-playing nation to do so","Read more about the 1979 World Cup
",1979 World cup,
F9,https://en.wikipedia.org/wiki/India_national_cricket_team#/media/File:Flagcricket.jpg,No wins for India,"India failed to win a single match in the competition, the only test-playing nation to do so","Read more about the 1979 World Cup
",Indian Cricket team,
F10,https://en.wikipedia.org/wiki/1983_Cricket_World_Cup#/media/File:Prudential_Cup_83_logo.svg,No ‘Man of the Series’,No ‘Man of the Series’ award was awarded during the 1983 World Cup .,"Read more about the 1983 World Cup
",1983 World cup,
F11,https://en.wikipedia.org/wiki/1983_Cricket_World_Cup#/media/File:Prudential_Cup_83_logo.svg,Beyond the group stage,India had never qualified beyond the group stages in the previous editions of the tournament but went on to win the 1983 World Cup,"Read more about the 1983 World Cup
",1983 World cup,
F12,https://en.wikipedia.org/wiki/India_national_cricket_team#/media/File:Flagcricket.jpg,Beyond the group stage,India had never qualified beyond the group stages in the previous editions of the tournament but went on to win the 1983 World Cup,Read more about the Indian Cricket team,Indian Cricket team,
F13,https://en.wikipedia.org/wiki/1983_Cricket_World_Cup#/media/File:Prudential_Cup_83_logo.svg,Lowest score defended,India scored 183 runs in the final which is the lowest score defended by a country in the World Cup final,Read more about the Indian Cricket team,Indian Cricket team,
F14,https://en.wikipedia.org/wiki/1987_Cricket_World_Cup#/media/File:Worldcup1987.jpg,50 overs,This was the first World Cup to be played with 50 overs instead of 60.,"Read more about the 1987 World Cup
",1987 World cup,
F15,https://en.wikipedia.org/wiki/1987_Cricket_World_Cup#/media/File:Worldcup1987.jpg,Close fight,Australia defeated their arch-rivals England by 7 runs in the closest  World Cup final  at Kolkata's Eden Gardens.  ,"Read more about the 1987 World Cup
",1987 World cup,
F16,https://en.wikipedia.org/wiki/2007_Cricket_World_Cup#/media/File:Australian_World_Cup_treble.jpg,Close fight,Australia defeated their arch-rivals England by 7 runs in the closest  World Cup final  at Kolkata's Eden Gardens.  ,"Read more about the Australian cricket team
",Australian Cricket team,
F17,https://en.wikipedia.org/wiki/1987_Cricket_World_Cup#/media/File:Worldcup1987.jpg,Decline of  Invincible West Indies,West Indies failed to qualify the group stage in 1987 for the first time since the World Cup’s inception. ,"Read more about the 1987 World Cup
",1987 World cup,
F18,https://en.wikipedia.org/wiki/1992_Cricket_World_Cup#/media/File:World_Cup_1992_logo.svg,Colors,"The 1992 World Cup was the first to feature coloured player clothing, white cricket balls and black sight screens.","Read more about the 1992 World Cup
",1992 World cup,
F19,https://en.wikipedia.org/wiki/1992_Cricket_World_Cup#/media/File:World_Cup_1992_logo.svg,End of Apartheid,1992 World cup was the first to have South Africa participate after the end of the Apartheid.,"Read more about the 1992 World Cup
",1992 World cup,
F20,https://en.wikipedia.org/wiki/South_Africa_national_cricket_team#/media/File:South_African_Cricket_team_2008.jpg,End of Apartheid,1992 World cup was the first to have South Africa participate after the end of the Apartheid.,"Read more about the South african cricket team
",South African Cricket team,
F21,https://en.wikipedia.org/wiki/1992_Cricket_World_Cup#/media/File:World_Cup_1992_logo.svg,22 runs off of 1 ball,"In the rain-affected semi-final match between England and South Africa, the final score was calculated using the “Most Productive Overs” method - reducing the required score of 22 off 13 balls to 22 off 1 ball, ending South Africa’s World Cup dreams that year.","Read more about the 1992 World Cup
",1992 World cup,
F22,https://en.wikipedia.org/wiki/South_Africa_national_cricket_team#/media/File:South_African_Cricket_team_2008.jpg,22 runs off of 1 ball,"In the rain-affected semi-final match between England and South Africa, the final score was calculated using the “Most Productive Overs” method - reducing the required score of 22 off 13 balls to 22 off 1 ball, ending South Africa’s World Cup dreams that year.","Read more about the South african cricket team
",South African Cricket team,
F23,https://en.wikipedia.org/wiki/1996_Cricket_World_Cup#/media/File:Wills_World_Cup_1996.svg,Walkover wins  ,"Australia and West Indies forfeited their matches against Sri Lanka due to terrorist attacks in Colombo, Sri Lanka.","Read more about the 1996 World Cup
",1996 World Cup,
F24,https://en.wikipedia.org/wiki/1996_Cricket_World_Cup#/media/File:Wills_World_Cup_1996.svg,Host win,"In the 1996 World Cup, Sri Lanka won to become the first co-host country to win the World Cup.","Read more about the 1996 World Cup
",1996 World Cup,
F25,https://en.wikipedia.org/wiki/Sri_Lanka_national_cricket_team#/media/File:Sri_Lanka_Cricket_Cap_Insignia.svg,Srilankan Cricket Team,"In the 1996 World Cup, Sri Lanka won to become the first co-host country to win the World Cup.","Read more about the 1996 World Cup
",Srilankan Cricket team,
F26,https://en.wikipedia.org/wiki/1999_Cricket_World_Cup#/media/File:Wc99.png,"The Duke ball controversy
",A controversial  type of cricket ball - the white ‘Duke’ was introduced for the first time in the 1999 World Cup. They were proven to be harder and to swing significantly more.. ,"Read more about the 1999 World Cup
",1999 World Cup,
F27,https://en.wikipedia.org/wiki/1999_Cricket_World_Cup#/media/File:Wc99.png,At war,"India and Pakistan were officially at war during their match in this edition of the World Cup, the only time two nations at war to have engaged in a sports game in the political scenario.","Read more about the 1999 World Cup
",1999 World Cup,
F28,https://en.wikipedia.org/wiki/India_national_cricket_team#/media/File:Flagcricket.jpg,At war,"India and Pakistan were officially at war during their match in this edition of the World Cup, the only time two nations at war to have engaged in a sports game in the political scenario.",Read more about the Indian Cricket team,Indian Cricket team,
F29,https://en.wikipedia.org/wiki/1999_Cricket_World_Cup#/media/File:Wc99.png,"The Tie
","Despite a tie in the semi-finals, Australia progressed to the final due to finishing higher on the ‘Super Six’ table, thanks to their higher net run rate when compared to South Africa.","Read more about the 1999 World Cup
",1999 World Cup,
F30,https://en.wikipedia.org/wiki/2003_Cricket_World_Cup#/media/File:Cricket_World_Cup_Logo_2003.svg,The first African World Cup,The 2003 World Cup was the first edition to be hosted in Africa.,"Read more about the 2003 World Cup
",2003 World Cup,
F31,https://en.wikipedia.org/wiki/2003_Cricket_World_Cup#/media/File:Cricket_World_Cup_Logo_2003.svg,Kenya,Kenya became the only non test-playing nation to reach the semi-finals of a World Cup,"Read more about the 2003 World Cup
",2003 World Cup,
F32,https://en.wikipedia.org/wiki/2003_Cricket_World_Cup#/media/File:Cricket_World_Cup_Logo_2003.svg,Shane Warne banned,"Australian star player Shane Warne was sent home from the Cup, in embarrassing circumstances, on the day before their opening game after a positive drug test.","Read more about the 2003 World Cup
",2003 World Cup,
F33,https://en.wikipedia.org/wiki/2007_Cricket_World_Cup#/media/File:2007_Cricket_World_Cup_logo.svg,Unbeaten Australia,Australia's unbeaten record in the tournament increased their total wins to 29 consecutive World Cup matches,"Read more about the 2007 World Cup
",2007 World Cup,
F34,https://en.wikipedia.org/wiki/2007_Cricket_World_Cup#/media/File:Australian_World_Cup_treble.jpg,Unbeaten Australia,Australia's unbeaten record in the tournament increased their total wins to 29 consecutive World Cup matches in the 2007 cricket World cup,"Read more about the Australian cricket team
",Australian Cricket team,
F35,https://en.wikipedia.org/wiki/2007_Cricket_World_Cup#/media/File:2007_Cricket_World_Cup_logo.svg,Death of Bob Woolmer,"Pakistan coach Bob Woolmer was found dead on 18 March 2007, a day after his team's defeat to Ireland put them out of the running for the World Cup ","Read more about the 2007 World Cup
",2007 World Cup,
F36,https://en.wikipedia.org/wiki/1996_Cricket_World_Cup#/media/File:Wills_World_Cup_1996.svg,Dismal Indian performance,"Since 1979, this was the first time India failed to qualify the group stage.",Read more about the Indian Cricket team,Indian Cricket team,
F37,https://en.wikipedia.org/wiki/2011_Cricket_World_Cup#/media/File:2011_Cricket_World_Cup_Logo.svg,Win on Home soil,India became the first country to win the World Cup on home grounds. ,"Read more about the 2011 World Cup
",2011 World Cup,
F38,https://en.wikipedia.org/wiki/1996_Cricket_World_Cup#/media/File:Wills_World_Cup_1996.svg,Win on Home soil,India became the first country to win the World Cup on home grounds. ,Read more about the Indian Cricket team,Indian Cricket team,
F39,https://en.wikipedia.org/wiki/2011_Cricket_World_Cup#/media/File:2011_Cricket_World_Cup_Logo.svg,2.2 billion viewers,The 2011 World Cup is the most viewed edition with 2.2 billion Worldviewers worldwide,"Read more about the 2011 World Cup
",2011 World Cup,
F40,https://en.wikipedia.org/wiki/2011_Cricket_World_Cup#/media/File:2011_Cricket_World_Cup_Logo.svg,Toss done twice,"The toss had to be repeated owing to the loud noise in the crowd during the finals– an extremely unusual event, especially at a prominent event such as the World Cup final. ","Read more about the 2011 World Cup
",2011 World Cup,
F41,https://en.wikipedia.org/wiki/2015_Cricket_World_Cup#/media/File:2015_Cricket_World_Cup_Logo.svg,Super over,"In 2015, ICC reinstated the use of Super Over for cricket World Cup Finals if the match ended in a tie","Read more about the 2015 World Cup
",2015 World Cup,
F42,https://en.wikipedia.org/wiki/2015_Cricket_World_Cup#/media/File:2015_Cricket_World_Cup_Logo.svg,No Asian countries in the finals,"The 2015 World Cup final was the first time since 1992, that did not feature an Asian team in the finals","Read more about the 2015 World Cup
",2015 World Cup,
F43,https://en.wikipedia.org/wiki/Virat_Kohli#/media/File:Virat..Kohli.jpg,Debut Century ,Virat Kohli is the first Indian batsman to score a century in a debut match in the World Cup .,Read more about virat kohli,Virat Kohli,
F44,https://en.wikipedia.org/wiki/MS_Dhoni#/media/File:Mahendra_Singh_Dhoni_January_2016_(cropped).jpg,Thala Dhoni ,Dhoni is the first Indian captain to win all group stage matches in a World Cup.,Read more about M.S Dhoni,M.S Dhoni,
F45,https://en.wikipedia.org/wiki/MS_Dhoni#/media/File:Mahendra_Singh_Dhoni_January_2016_(cropped).jpg,Dhoni 100 ,"At the 2015 cricket World Cup, Dhoni became the first Indian captain and the first non-Australian captain to register 100 wins. ",Read more about M.S Dhoni,M.S Dhoni,
F46,https://en.wikipedia.org/wiki/Rohit_Sharma#/media/File:Rohit_Sharma_November_2016_(cropped).jpg,Hitman,"With 71 sixes, Sharma hit the most number of sixes in a year (2018)",Read more about Rohit Sharma,Rohit Sharma,
F47,https://en.wikipedia.org/wiki/Shikhar_Dhawan#/media/File:SHIKHAR_DHAWAN_(16005494418).jpg,Big Match player,"A prolific run scorer in ICC tournaments, he holds the record for the fastest1000 runs scored in the ICC tournaments.  ",Read more about Shikar Dhawan,Shikar Dhawan,
F48,https://en.wikipedia.org/wiki/David_Warner_(cricketer)#/media/File:DAVID_WARNER_(11704782453).jpg,"No first class experience
",Warner is the first Australian cricketer in 132 years to be selected for a national team in any format without experience in first-class cricket.,Read more about David warner,David Warner,
F49,https://en.wikipedia.org/wiki/Kane_Williamson#/media/File:Kane_Williamson_(9773667991).jpg,Youngest player,Kane williamson is the youngest player to score centuries against all test playing nations,Read more about Kane Williamson,Kane Williamson,
F50,https://en.wikipedia.org/wiki/Jos_Buttler#/media/File:Jos_Buttler_2017.jpg,Five Fifties,Jos Butler is the second batsman in IPL history to achieve five scores of fifty or more in consecutive matches,Read more about Jos Butler,Jos Butler,
F51,"https://en.wikipedia.org/wiki/Chris_Gayle#/media/File:Chris_Gayle,_2010_(1).jpg",Gayle storm,"Gayle is the only player in world cricket to hit a triple hundred in Tests, a double hundred in ODIs and a hundred in Twenty20 Internationals ",Read more about Chris Gayle,Chris Gayle,
F52,https://en.wikipedia.org/wiki/Kagiso_Rabada#/media/File:Rabada.jpg,Kagiso Rabada,Rabada is the youngest bowler to take 150 wickets in Test cricket.,Read more about Kagiso Rabada,Kagiso Rabada,
F53,https://en.wikipedia.org/wiki/1996_Cricket_World_Cup#/media/File:Wills_World_Cup_1996.svg,300+,Indian cricket team holds the record for most number of times scoring 300+ score: 90 times .,Read more about Indian Cricket Team,Indian cricket team,
F54,https://en.wikipedia.org/wiki/2007_Cricket_World_Cup#/media/File:Australian_World_Cup_treble.jpg,Four World cup finals ,Australian team holds the record for appearing in four consecutive World Cup finals between 1996 - 2007,Read more about Australian Cricket Team,Australian cricket team,
F55,https://en.wikipedia.org/wiki/England_cricket_team#/media/File:The_England_Cricket_Team_Ashes_2015.jpg,Oldest Cricket team,The first recorded incidence of a team with a claim to represent England comes from 9 July 1739,Read more about England Cricket Team,England cricket team,
F56,https://en.wikipedia.org/wiki/West_Indies_cricket_team#/media/File:BrianLaraUkexpat.jpg,West Indies power,West Indies is a multi-national cricket team representing the Anglophone Caribbean region with players selected from a chain of fifteen Caribbean territories,Read more about West indies Cricket Team,West indies team,
F57,https://en.wikipedia.org/wiki/Bangladesh_national_cricket_team#/media/File:Flag_of_Bangladesh.svg,Hat Trick Debut,Taijul Islam became the first bowler ever to take a hat-trick on debut in an ODI against Zimbabwe at Dhaka in 2014,Read more about Bangladesh Cricket Team,Bangladesh Team,
F58,https://en.wikipedia.org/wiki/Afghanistan_national_cricket_team#/media/File:Afghanistan_cricket_board_logo.jpg,Not A-Ban-Doned!,"In 2000, Cricket became the only sport in Afghanistan to be approved by the Taliban and the Afghanistan Cricket Federation was elected as an affiliate member of the ICC the following year ",Read more about Afghanistan Cricket Team,Afghanistan Team,
F59,https://en.wikipedia.org/wiki/Afghanistan_national_cricket_team#/media/File:Afghanistan_cricket_board_logo.jpg,A Bilateral Record,"In 2015, Afghanistan beat Zimbabwe to become the first non-Test-playing country to win a multi-game bilateral ODI series against a Test side",Read more about Afghanistan Cricket Team,Afghanistan Team,
F60,https://en.wikipedia.org/wiki/New_Zealand_national_cricket_team#/media/File:New_Zealand_Cricket_Cap_Insignia.svg,Team of the Match,"In  April 1996, New Zealand achieved a unique world record, where the whole team was adjudged Man of the Match for team performance against 4 run victory over the West Indies. This is recorded as the only time where whole team achieved such an award",Read more about New Zealand Cricket Team,New Zealand Team,
