,,https://upload.wikimedia.org/wikipedia/en/8/81/Sunrisers_Hyderabad.svg,R12,https://en.wikipedia.org/wiki/Sunrisers_Hyderabad,सनराइजर्स हैदराबाद,R12,"सनराइजर्स हैदराबाद (संक्षिप्त रूप में एसआरएच) तेलंगाना के हैदराबाद आधारित एक फ्रेंचाइजी क्रिकेट टीम है, जो इंडियन प्रीमियर लीग (आईपीएल) में खेलती है।",हैदराबाद,G13,2013,,,,,,,,Kane Williamson,https://en.wikipedia.org/wiki/Kane_Williamson#/media/File:Kane_Williamson_(9773667991).jpg,O30,Tom Moody,https://en.wikipedia.org/wiki/Tom_Moody#/media/File:Tom_Moody_Sunrisers.jpg,,Rajiv Gandhi International Cricket Stadium,"राजीव गांधी अंतरराष्ट्रीय क्रिकेट स्टेडियम, हैदराबाद","The Rajiv Gandhi International Cricket Stadium is the principal cricket stadium in Hyderabad, Telangana, India and is the home ground of the Hyderabad Cricket Association.  It is located in Uppal, an eastern suburb of the city. It has a capacity of 55,000.","https://en.wikipedia.org/wiki/Rajiv_Gandhi_International_Cricket_Stadium,_Hyderabad#/media/File:RGIS_HYD.jpg",Initial years,2013-2014,Sunrisers Hyderabad made their IPL debut in the 2013 season. The team reached the playoffs but were eliminated after losing against Rajasthan Royals.,,,,,,,,,,,,,Maiden title and success,2015–2017,"For the 2015 season, David Warner was appointed as the captain for this season and led the team in all matches played. Warner won the first Orange Cap for Sunrisers Hyderabad.",,,,P24,,,,,,,,,Runners Up,2018,SRH finished the 2018 season as runners-up of the competition after losing to Chennai Super Kings in the final. Williamson won the Orange Cap with 735 runs.,,,,P25,,,,,,,,,,,,,,,,,,,,,,,,David Warner,Warner is the first Australian cricketer in 132 years to be selected for a national team in any format without experience in first-class cricket.,https://en.wikipedia.org/wiki/David_Warner_(cricketer)#/media/File:DAVID_WARNER_(11704782453).jpg,Kane Williamson,"During the New Zealand vs Pakistan 2014 ODI series, Williamson donated his entire match fee for all five ODIs to the victims of the 2014 Peshawar school massacre. He bowls and bats right handed but writes left handed.",https://en.wikipedia.org/wiki/Kane_Williamson,Bhuvneshwar Kumar,"After his five-wicket haul against South Africa in the first T20I in February 2018, Kumar became the first Indian bowler to take a five-wicket haul in all formats of the game.",https://en.wikipedia.org/wiki/Bhuvneshwar_Kumar#/media/File:Bhuvneshwar_Kumar.jpg,Martin Guptill,Guptill is the first cricketer from New Zealand and the fifth overall to have scored a double century in a One Day International match and holds the current record for the highest individual score in Cricket World Cup matches.,https://en.wikipedia.org/wiki/Martin_Guptill#/media/File:Martin_Guptill_2_(cropped).jpg,2013 Indian Premier League,Semi-finalists of the 2013 Indian Premier League,,,2015 Indian Premier League,Winner of Orange Cap (David Warner – 562 runs),,P24,2016 Indian Premier League,Champions of the 2016 Indian Premier League,,P25,2017 Indian Premier League,Winner of Purple Cap (Bhuvneshwar Kumar – 26 wickets),O15,,,,,,Kit sponsor,TYKA Sports,https://en.wikipedia.org/wiki/TYKA_Sports#/media/File:TYKASports_logo.png,Shirt Sponsor (Front),Coolwinks.com,,,,,,,
,,https://en.wikipedia.org/wiki/Afghanistan_national_cricket_team#/media/File:Afghanistan_cricket_board_logo.jpg,R17,https://en.wikipedia.org/wiki/Sunrisers_Hyderabad,अफगानिस्तान की राष्ट्रीय क्रिकेट टीम,R17,"अफगानिस्तान की राष्ट्रीय क्रिकेट टीम  टेस्ट क्रिकेट खेलने वाला 12वां पूर्ण सदस्य देश है। अफगानिस्तान में 19वीं शताब्दी के मध्य से क्रिकेट खेला जाता रहा है, लेकिन हाल के वर्षों में ही वह राष्ट्रीय टीम के रूप में सफल हुआ है।",अफगानिस्तान,,1995,अफगानिस्तान क्रिकेट बोर्ड,Rahmat Shah,,,Gulbadin Naib,,,Rashid Khan,,O41,Phil Simmons,,,,कोई नहीं,Afghanistan do not play their home matches in Afghanistan due to the ongoing security situation and the lack of international standard facilities.,https://commons.wikimedia.org/w/index.php?search=none&title=Special%3ASearch&profile=advanced&fulltext=1&advancedSearch-current=%7B%7D&ns0=1&ns6=1&ns12=1&ns14=1&ns100=1&ns106=1#/media/File:Icon_None.svg,Pre-ODI history,1839,"The earliest record of cricket in Afghanistan is of British troops playing a match in Kabul in 1839, though it appears that no long lasting legacy of cricket was left by the British.",,,,,,,,,,,,,Domestic Cricket,2001,The national team was invited to play in the second tier of Pakistani domestic cricket and the tour brought international media attention to Afghan cricket.,,,,,,,,,,,,,2015 Cricket World Cup,2015,"Afghanistan made their World Cup debut in the 50 over format of the game against Bangladesh at the Manuka Oval in Canberra, Australia. ",,,,P8,,,,,,,,,First test match victory,2019,"In March 2019 against Ireland, Afghanistan achieved their first-ever test match victory in their only second test match, becoming only 3rd team after England and Pakistan to do so.",,,,,,,,,,,,,Mohammed Nabi,"Mohammad Nabi is an Afghan cricketer who has captained the side in limited overs matches. He played a major role in Afghanistan's rise to the top level of international cricket, playing in both their first One Day International and their first Test match. ",https://en.wikipedia.org/wiki/Mohammad_Nabi#/media/File:Mohammad_Nabi-Australia.jpg,Gulbadin Naib,"Naib is a right-handed batsman who bowls right-arm fast-medium. In April 2019, the Afghanistan Cricket Board (ACB) named Naib as the team's new One Day International (ODI) captain ahead of the 2019 Cricket World Cup,",,Rashid Khan,Rashid Khan is an Afghan cricketer and the current Twenty20 International (T20I) captain of the national team. He returned the most expensive bowling figures by a debutant in a nation's maiden Test match.,,Hashmatullah Shahidi,Hashmatullah Shahidi is an Afghan cricketer. He made his One Day International debut for Afghanistan against Kenya in October 2013.,,2015 World Cup Qualifiers,"On 4 October 2013, Afghanistan qualified for their first Cricket World Cup after beating Kenya to finish in second place behind Ireland.",,,Participation in World Cup,The 2015 Cricket World was the first and to date the only Cricket World Cup Afghanistan has participated in. Afghanistan was grouped with hosts Australia and New Zealand.,,P8,2018 Cricket World Cup Qualifier,"Afghanistan won the tournament, beating the West Indies in the final. Afghanistan's Mohammad Shahzad was named the player of the match.",,,,,,,,,,,,,,,,,,,,,,
,,https://en.wikipedia.org/wiki/Bangladesh_national_cricket_team#/media/File:Flag_of_Bangladesh.svg,R18,https://en.wikipedia.org/wiki/Bangladesh_national_cricket_team,बांग्लादेश की राष्ट्रीय क्रिकेट टीम,R18,"बांग्लादेश की राष्ट्रीय क्रिकेट टीम, जो ""द टाइगर्स"" के नाम से भी मशहूर है का संचालन बांग्लादेश क्रिकेट बोर्ड (बीसीबी) द्वारा किया जाता है। बांग्लादेश टेस्ट और एकदिवसीय अंतरराष्ट्रीय (ओडीआई) में अंतर्राष्ट्रीय क्रिकेट परिषद (आईसीसी) का पूर्ण सदस्य है।",बांग्लादेश की राष्ट्रीय क्रिकेट टीम,,,बांग्लादेश क्रिकेट बोर्ड,Shakib Al Hasan,https://en.wikipedia.org/wiki/Shakib_Al_Hasan#/media/File:Shakib_Al_Hasan_(4)_(cropped).jpg,,Mashrafe Mortaza,https://en.wikipedia.org/wiki/Mashrafe_Mortaza#/media/File:Mashrafe_Bin_Mortaza_(cropped).jpg,,Shakib Al Hasan,https://en.wikipedia.org/wiki/Shakib_Al_Hasan#/media/File:Shakib_Al_Hasan_(4)_(cropped).jpg,,Steve Rhodes,https://en.wikipedia.org/wiki/Steve_Rhodes#/media/File:Steve_Rhodes_(14)_(cropped).jpg,,Sher-e-Bangla National Cricket Stadium,शेर-ए-बांग्ला राष्ट्रीय क्रिकेट स्टेडियम,"The Sher-e-Bangla National Cricket Stadium (SBNCS), also called Mirpur Stadium, is a cricket ground in Dhaka, the capital of Bangladesh. The ground holds approximately 25,000 people. The venue was taken over by the Bangladesh Cricket Board in 2004, as the home of both the men's and women's national teams. ",,Bangladesh Cricket Board,1972-1977,"In 1972, the government created the Bangladesh Cricket Board, then called the Bangladesh Cricket Control Board, with a directive to organise cricket in the new country. ",,,,,,,,,,,,,International match with Sri Lanka,1978,The first full international team to visit Bangladesh was Sri Lanka in January 1978. Sri Lanka was then close to ICC Full Member status (achieved in 1982) and their higher standard was underlined by a series of innings victories in the three international matches against Bangladesh. ,,,,,,,,,,,,,1979–80 season,1979-1980,Pakistan visited Bangladesh for the first time. It was eight years after the end of the Liberation War but tensions were still evident. ,,,,,,,,,,,,,1999 Cricket World Cup,1999,"The Bangladesh team played in the Cricket World Cup for the first time, having qualified by winning the 1997 ICC Trophy, for the 1999 tournament in Great Britain.",,,,,,,,,,,,,Mashrafe Mortaza,"In April 2019, he was named as the captain of Bangladesh's squad for the 2019 Cricket World Cup.",https://en.wikipedia.org/wiki/Mashrafe_Mortaza#/media/File:Mashrafe_Bin_Mortaza_(cropped).jpg,Shakib Al Hasan,Shakib Al Hasan is a Bangladeshi international cricketer who currently captains the Bangladesh national team in Test and T20I formats. He is considered as the best and greatest cricketer to have ever played for Bangladesh.,https://en.wikipedia.org/wiki/Shakib_Al_Hasan#/media/File:Shakib_Al_Hasan_(4)_(cropped).jpg,Mushfiqur Rahim,Mohammad Mushfiqur Rahim is a Bangladeshi cricketer and the former captain of the Bangladesh national cricket team.He holds the record for highest score by a test Bangladesh batsman.,https://en.wikipedia.org/wiki/Mushfiqur_Rahim#/media/File:Mushfiqur_Rahim_2009_(cropped).jpg,Tamim Iqbal,"Muhammad Tamim Iqbal Khan is a Bangladeshi international cricketer. A left-handed opening batsman, he is the Bangladeshi's most successful runscorer to date. ",https://en.wikipedia.org/wiki/Tamim_Iqbal#/media/File:Tamim-Iqbal-wt20.png,1999 Cricket World Cup,They appeared for the first time in World Cup in the 1999 Cricket World Cup as an associate team. ,,,2007 Cricket World Cup,Bangladesh enjoyed a good tournament with two great wins against India and South Africa.,,P6,2011 Cricket World Cup,Bangladesh was a co-host with India for the 2011 Cricket World Cup.,,P7,All-rounder category number 1,"Shakib Al Hasan became the first player in history to hold the number 1 positions in all three formats of cricket, in the all-rounder category on 12 January 2015.",,,,,,,Main Sponsor,Grameenphone,https://en.wikipedia.org/wiki/Grameenphone#/media/File:Grameephone_Logo.png,,,,,,,,,
,,https://en.wikipedia.org/wiki/Sri_Lanka_national_cricket_team#/media/File:Sri_Lanka_Cricket_Cap_Insignia.svg,R13,https://en.wikipedia.org/wiki/Sri_Lanka_national_cricket_team,श्रीलंका की राष्ट्रीय क्रिकेट टीम,R13,"श्रीलंका की राष्ट्रीय क्रिकेट टीम, जिसे 'द लायंस' के नाम से भी जाना जाता है। यह अंतरराष्ट्रीय क्रिकेट में श्रीलंका का प्रतिनिधित्व करती है। यह टेस्ट, एकदिवसीय अंतरराष्ट्रीय (ओडीआई) और टी-20 अंतरराष्ट्रीय (टी20आई) में अंतरराष्ट्रीय क्रिकेट परिषद (आईसीसी) का पूर्ण सदस्य देश है।",श्रीलंका की राष्ट्रीय क्रिकेट टीम,G7,,श्रीलंका क्रिकेट,Dimuth Karunaratne,,,Dimuth Karunaratne,,,Lasith Malinga,https://en.wikipedia.org/wiki/Lasith_Malinga#/media/File:LASITH_MALINGA_(5155175549).jpg,O40,Chandika Hathurusingha,,,Galle International Stadium,गाले अंतरराष्ट्रीय स्टेडियम,"Galle International Stadium is a cricket stadium in Galle, Sri Lanka, situated near the Galle fort and fringed on two sides by the Indian Ocean. It is considered to be one of the most picturesque cricket grounds in the world. ",https://en.wikipedia.org/wiki/Galle_International_Stadium#/media/File:Sri_Lanka_vs_Pakistan_test_match.JPG, Ceylon national cricket team,1972,"Renamed Sri Lanka in 1972, the national team first competed in top level international cricket in 1975, when they played against West Indies during 1975 Cricket World Cup",,,,P26,,,,,,,,,First test win,1981,"After Sri Lanka was awarded Test status in 21 July 1981 as eighth Test playing nation, they had to wait until 6 September 1985, where Sri Lanka recorded their first Test win by beating India",,,,,,,,,,,,,1990s,1990s,"Sri Lanka had to wait for more than 7 years for their next series victory, which came against New Zealand in December 1992. ",,,,,,,,,,,,,Comparison with other teams,2018,"Sri Lanka have registered more wins against Pakistan and Bangladesh than any other team, with 14.",,,,,,,,,,,,,Lasith Malinga,"Separamadu Lasith Malinga bowls right-arm fast-medium and, is commonly used as a specialist death bowler, which lead to his nicknames, ""Slinga Malinga"" and ""Malinga the Slinga"".",https://en.wikipedia.org/wiki/Lasith_Malinga#/media/File:LASITH_MALINGA_(5155175549).jpg,Dinesh Chandimal,Chandimal holds the joint record for taking the most number of catches in a single T20I as a fielder.,https://en.wikipedia.org/wiki/Dinesh_Chandimal#/media/File:Dinesh_Chandimal_2.JPG,Angelo Mathews,"Angelo Davis Mathews, is a professional Sri Lankan cricketer and a former captain in all formats.",https://en.wikipedia.org/wiki/Angelo_Mathews#/media/File:Angelo_Mathews_(5338334462).jpg,Thisara Perera,"Thisara Perera, is a professional Sri Lankan cricketer. He was purchased by the Chennai Super Kings for US$50,000 in the auction for the 2010 Indian Premier League.",https://en.wikipedia.org/wiki/Thisara_Perera#/media/File:Thisara_Perera.jpg,1996 Cricket World Cup," Winners of the 1996 Cricket World Cup, which they co-hosted with India & Pakistan",,,Winners of the 2002 ICC Champions Trophy,"Joint winners of the 2002 ICC Champions Trophy, which they also hosted in their own right",,P10,2007 Cricket World Cup,"Runners up in the 2007 Cricket World Cup, hosted by the West Indies",,P6,2011 Cricket World Cup,"Runners up of the 2011 Cricket World Cup, which they co-hosted with India & Bangladesh.",P7,,,,,,Sponsors,Dilmah ,https://en.wikipedia.org/wiki/Dilmah#/media/File:Dilmah-Logo.jpg,"Principal Sponsor, 2019 World Cup",Kent RO Systems,https://en.wikipedia.org/wiki/Kent_RO_Systems#/media/File:KENT_Healthcare_Logo.jpg,,,,,,
,,https://en.wikipedia.org/wiki/South_Africa_national_cricket_team#/media/File:Southafrica_cricket_logo.svg,R14,https://en.wikipedia.org/wiki/South_Africa_national_cricket_team,दक्षिण अफ्रीका की राष्ट्रीय क्रिकेट टीम,R14,"दक्षिण अफ्रीका की राष्ट्रीय क्रिकेट टीम, उपनाम प्रोटियाज का संचालन क्रिकेट दक्षिण अफ्रीका द्वारा किया जाता है। दक्षिण अफ्रीका टेस्ट,  एकदिवसीय अंतरराष्ट्रीय (ओडीआई) और टी-20 अंतरराष्ट्रीय (टी-20आई) में अंतरराष्ट्रीय क्रिकेट परिषद (आईसीसी) का पूर्ण सदस्य है।",दक्षिण अफ्रीका,G6,,क्रिकेट दक्षिण अफ्रीका,Faf du Plessis,,,Faf du Plessis,,,Faf du Plessis,,,Ottis Gibson,,SF45,Wanderers Stadium,वांडरर्स स्टेडियम,"The Wanderers Stadium is a stadium situated in Johannesburg, South Africa. Test, One Day and First class cricket matches are played here. ",https://en.wikipedia.org/wiki/Wanderers_Stadium#/media/File:Wandrersflag.jpg,Beginnings and early developments,1843,"The oldest cricket club in South Africa is the Port Elizabeth Cricket Club, founded in 1843. ",,,,,,,,,,,,,England Tour,1888,Sir Donald Currie sponsored the first English team to tour South Africa. ,,,,,,,,,,,,,Australia Tour,1910-11,The South African cricket team toured Australia for the first time in 1910–11.,,,,,,,,,,,,,Current standings,2018,"As of 15 March 2018, the ICC ranks South Africa second in Tests, second in ODIs and seventh in T20Is, as well as sixth in the women's overall championship",,,,,,,,,,,,,Hashim Amla,Hashim Mohammad Amla is a South African international cricketer who plays for South Africa in all three formats of the game. He is a right-handed batsman and holds the record for the highest individual Test score of any South African batsman.,https://en.wikipedia.org/wiki/Hashim_Amla#/media/File:Hashim_Amla.jpg,Quinton de Kock,Quinton de Kock is a South African professional cricketer. He also plays for Mumbai Indians in Indian Premier League. He was named the Cricketer of the Year at Cricket South Africa's 2017 Annual Awards.,https://en.wikipedia.org/wiki/Quinton_de_Kock#/media/File:QUINTON_DE_KOCK_(15681398316).jpg,David Miller,David Miller is the former captain of the Kings XI Punjab in the Indian Premier League (IPL) and represents South Africa in both One Day Internationals (ODIs) and Twenty20 Internationals.,https://en.wikipedia.org/wiki/David_Miller_(cricketer)#/media/File:DAVID_MILLER_(15704846295).jpg,JP Duminy,"Jean-Paul Duminy, often shortened to JP Duminy, is an international South African cricketer. He is vice-captain of the South Africa T20I team. He plays for the IPL cricket team Mumbai Indians.",https://en.wikipedia.org/wiki/JP_Duminy#/media/File:JP_DUMINY_(15681037986).jpg,ICC Champions Trophy,South Africa won the 1998 ICC Champions Trophy,,,2003 Cricket World Cup,South Africa hosted the 2003 Cricket World Cup,,P5,,,,,,,,,,,,,Kit sponsor,New Balance,https://en.wikipedia.org/wiki/New_Balance#/media/File:New_Balance_logo.svg,Shirt Sponsor,Standard Bank,https://en.wikipedia.org/wiki/Standard_Bank#/media/File:Standard_Bank_SA_logo.svg,,,,,,
,,https://en.wikipedia.org/wiki/New_Zealand_national_cricket_team#/media/File:New_Zealand_Cricket_Cap_Insignia.svg,R15,https://en.wikipedia.org/wiki/New_Zealand_national_cricket_team,न्यूजीलैंड की राष्ट्रीय क्रिकेट टीम,R15,"न्यूजीलैंड की राष्ट्रीय क्रिकेट टीम, जिसका निकनेम ब्लैक कैप्स भी है, उसने अपना पहला टेस्ट वर्ष 1930 में इंग्लैंड के खिलाफ क्राइस्टचर्च में खेला था, जो टेस्ट क्रिकेट खेलने वाला पांचवा देश बना।",न्यूजीलैंड की राष्ट्रीय क्रिकेट टीम,G8,,न्यूजीलैंड क्रिकेट,Kane Williamson,https://en.wikipedia.org/wiki/Kane_Williamson#/media/File:Kane_Williamson_(9773667991).jpg,O30,Kane Williamson,https://en.wikipedia.org/wiki/Kane_Williamson#/media/File:Kane_Williamson_(9773667991).jpg,O30,Kane Williamson,https://en.wikipedia.org/wiki/Kane_Williamson#/media/File:Kane_Williamson_(9773667991).jpg,O30,Gary Stead,,SF46,Eden Park,,"Eden Park is New Zealand's largest sports stadium, located in central Auckland, New Zealand. It is used primarily for cricket in summer.",https://en.wikipedia.org/wiki/Eden_Park#/media/File:Auckland_EdenPark.jpg,Beginnings of cricket in New Zealand,1842,The first recorded game of cricket in New Zealand took place in Wellington in December 1842.,,,,,,,,,,,,,First national team,1904-1905,New Zealand played its first two internationals (not Tests) in 1904–05 against a star-studded Australia team,,,,,,,,,,,,,Inter-war period,1927,"In 1927 New Zealant toured England. They played 26 first class matches, mostly against county sides.",,,,,,,,,,,,,After World War II,1950s,"New Zealand played its first matches against the West Indies in 1951–52, and Pakistan and India in 1955/56.",,,,,,,,,,,,,Martin Guptill,"Martin James Guptill, is a New Zealand international cricketer who plays as an opening batsman. Guptill holds the current record for the highest individual score in Cricket World Cup matches.",https://en.wikipedia.org/wiki/Martin_Guptill#/media/File:Martin_Guptill_2_(cropped).jpg,Colin Munro,Colin Munro is a South-African born New Zealand international cricketer. He is the first player to score three Twenty20 International centuries.,https://en.wikipedia.org/wiki/Colin_Munro#/media/File:Colin_Munro_with_the_Sydney_Sixers.jpg,Kane Williamson,Kane Stuart Williamson (is a New Zealand international cricketer who is currently the captain of the New Zealand national team and Sunrisers Hyderabad in the Indian Premier League. He is considered as one of the best batsmen in the world.,https://en.wikipedia.org/wiki/Kane_Williamson#/media/File:Kane_Williamson_(9773667991).jpg,Ross Taylor,"Taylor is considered as one of the greatest batsmen to represent New Zealand and became the nation's highest ODI century maker in 2017, with his 17th ODI century.",https://en.wikipedia.org/wiki/Ross_Taylor#/media/File:Ross_Taylor_(6159940521)_(cropped).jpg,1992 Cricket World Cup,New Zealand were hosts and semi finalists of the 1992 Cricket World Cup,,,2007 Cricket World Cup,New Zealand went through to the semifinals and placed 3rd overall.,,P6,2009 ICC Champions Trophy,New Zealand was runner's up in the 2009 ICC Champions Trophy,,P10,2015 Cricket World Cup,New Zealand was Runners-up at the 2015 Cricket World Cup.,P8,,,,,,Shirt Sponsor (Chest and Sleeves),ANZ,https://en.wikipedia.org/wiki/Australia_and_New_Zealand_Banking_Group#/media/File:ANZ-brand.svg,Kit sponsor,Canterbury,https://en.wikipedia.org/wiki/Canterbury_of_New_Zealand#/media/File:Canterbury_of_New_Zealand_logo.svg,Chest Branding,Lotus Herbals,,,,
